{
  "request_id": "rag_req_dense_002",
  "tenant_id": "tenant-enterprise-cyber",
  "actor": {
    "type": "user",
    "id": "soc:analyst:sarah.chen",
    "tenant_id": "tenant-enterprise-cyber"
  },
  "purpose": "alert_investigation",
  "query": {
    "text": "Detect unusual outbound TLS traffic to dynamic DNS domains on non-standard ports",
    "dense_embedding": [
      0.0123, -0.0456, 0.0789, 0.0234, -0.0567, 0.0891, 0.0345, -0.0678,
      0.0123, -0.0456, 0.0789, 0.0234, -0.0567, 0.0891, 0.0345, -0.0678,
      0.0123, -0.0456, 0.0789, 0.0234, -0.0567, 0.0891, 0.0345, -0.0678,
      0.0123, -0.0456, 0.0789, 0.0234, -0.0567, 0.0891, 0.0345, -0.0678,
      0.0123, -0.0456, 0.0789, 0.0234, -0.0567, 0.0891, 0.0345, -0.0678,
      0.0123, -0.0456, 0.0789, 0.0234, -0.0567, 0.0891, 0.0345, -0.0678,
      0.0123, -0.0456, 0.0789, 0.0234, -0.0567, 0.0891, 0.0345, -0.0678,
      0.0123, -0.0456, 0.0789, 0.0234, -0.0567, 0.0891, 0.0345, -0.0678
    ],
    "collections": ["internal-threat-hunts", "soc-playbooks"]
  },
  "search_parameters": {
    "dense": {
      "enabled": true,
      "model_id": "text-embedding-3-large",
      "top_k": 10,
      "similarity_metric": "cosine",
      "score_threshold": 0.72
    },
    "sparse": {
      "enabled": false,
      "algorithm": "bm25",
      "top_k": 10
    },
    "rrf": {
      "enabled": false,
      "k_constant": 60,
      "top_k_final": 10
    }
  },
  "access_control": {
    "tlp_marking_filter": ["TLP:CLEAR", "TLP:GREEN", "TLP:AMBER", "TLP:RED"],
    "classification_clearance_bound": "restricted",
    "tenant_isolation": {
      "tenant_id": "tenant-enterprise-cyber",
      "enforce_strict_tenant_boundary": true,
      "allowed_cross_tenant_shares": []
    },
    "handling_caveats": ["air-gap-only"]
  },
  "results": [],
  "created_at": "2026-09-04T20:35:00Z",
  "digest": "sha256:3333333333333333333333333333333333333333333333333333333333333333"
}
